echconfig,versions,cipher_suites,public_names,domain_count,example_domains
AEX+DQBB4wAgACD7KKwLvxAZeNRfn+RMifhub9VaY63BJtppgT0W7fcDFwAEAAEAAQASY2xvdWRmbGFyZS1lY2guY29tAAA=,0xfe0d,HKDF-SHA256 + AES-128-GCM,cloudflare-ech.com,10323,"kinosvinka.cc, myflixerz.to, www.autostrada.info, bt-partner.com.ua, holywarsoo.net"
AEX+DQBBvAAgACDJd/EabPEcMfKX0Em/UGfcQXgccEu/rvvGoJj3dCJzBAAEAAEAAQASY2xvdWRmbGFyZS1lY2guY29tAAA=,0xfe0d,HKDF-SHA256 + AES-128-GCM,cloudflare-ech.com,4344,"kilogramm.com.ua, innovacia.com.ua, surveylama.com, tipok.store, ua.julla-mama.com"
,,,,325,"ikinogo.com, etf2l.org, nilvox.com.ua, www.craft-cards.com.ua, cxid.info"
AEP+DQA/ZAAgACAQl6+JD0EgImfsNsax1z7DChp28XMuJPw5+LPfIbvcAwAEAAEAAQAQdXN1YXJpb3Bvcm5vLmNvbQAA,0xfe0d,HKDF-SHA256 + AES-128-GCM,usuarioporno.com,4,"vps401.strip2.co, vps402.strip2.xyz, vps402.strip2.co, vps404.strip2.co"
AEP+DQA/hAAgACDXU+RNrdoLdDK+eh0PVKpE1XiqTaJ2YkuFOEKvmgrkHAAEAAEAAQAQc3BhY2VzLWdhbWVzLmNvbQAA,0xfe0d,HKDF-SHA256 + AES-128-GCM,spaces-games.com,1,spaces.im
AD7+DQA6JAAgACBSoBLuzZ4cW58Gw4tFHcGfcA8wSPRMdDDeEteTesfVXAAEAAEAAQALcG9ybmh1Yi5jb20AAA==,0xfe0d,HKDF-SHA256 + AES-128-GCM,pornhub.com,1,usersporn.com
